{
  "source_id": "src_demo_001",
  "source_type": "article_text",
  "source_lane": "article",
  "input_mode": "manual_paste",
  "title": "Example Foundry Intake Source",
  "raw_input_ref": "local://example/raw",
  "processed_output_ref": "local://example/processed",
  "source_url_or_locator": "https://example.com/research-note",
  "source_hash": "sha256:examplehash",
  "ingestion_method": "manual",
  "source_timestamp": "2026-04-09T00:00:00Z",
  "created_at": "2026-04-09T00:00:00Z",
  "reviewer_model": "human",
  "review_version": "v1",
  "extraction_version": "v1",
  "review_status": "complete",
  "extraction_status": "complete",
  "review_summary": "Example summary for deterministic engine validation.",
  "key_claims": [
    "Claim one",
    "Claim two"
  ],
  "quality_flags": [],
  "processing_notes": "Example processing notes.",
  "candidate_ids": [
    "cand_demo_001"
  ]
}
